id,hour_start,hour_end,summary,created_at
1,2025-10-07T12:00:00,2025-10-07T13:00:00,"Which often we want to go with but yeah, I guess it comes down I It's on like all finance have actually in the past transferred money directly to employer accounts for some reason I had in my head Like everything was supposed to go through our like reserve account, but maybe that's not true But directly transfer funds from funds to the view then we have better accounting That's a standard operating flow One of the viewers this month and next month We can't talk about that one either on one of the episodes Okay, and I know we have a vinter link 5 week meeting I have not been able to attend it yet But that is something that's helping help this early in the morning Maybe that's something we can add to our agenda, just ask them Okay, so you mean involved in those meetings? Yeah, I can ask you to add you to it Like, do you know what kind of transfers are easy to like, your calls to the wire? I think, my net set was a wire I think it's a wire, yeah Yeah, because otherwise we have to wait several days for it to clear That's what they're telling me on the day Okay, like go with the link, with that comment We're each transverse, they are transaction fees. I think I'll break it down and I'll move it but yeah, I think I tested we tested those components So that is it from my side and I'm fine with taking up something else Yeah, also I added like that small PR the buck that you assigned me yesterday Like that so he obviously see the need for this future before well especially because it's gonna be tens of thousands of records so trying to get performance issues and about getting some of the picture done appropriately. So it sounds like QuickBooks is all going to go into Mercury? Or any QuickBooks scenario is going to go from SDDs to Mercury? Is that right? Yeah, basically any QuickBooks scenario will be changed to using an SDD and will basically continue through the same process that finance was using where if the funds are flowing outside the app, except for the edge cases that Trader just touched on. ? It sounds like we have kind of things, uh, clear and map, like, uh, like, it does really impact our process for this month, but next month, we basically have, like, there's a couple, there's like one or two decision points, um, mainly than what we just talked about around adjusting a file, like, pushing for the employer accounts, and then from there, we can update our scripts.","2025-10-07 22:13:30"
2,2025-10-07T13:00:00,2025-10-07T14:00:00,"I'm still debugging I have like had multiple meetings over time but it looks like I think the AGC and also I've updated The new higher Frederick as well looks like it is it might be a VPN issue which is causing that Yeah, which is causing me not to connect to the snapshot and On the other hand right Alberto, I think yesterday Brian mentioned that you were taking over the SQS, is that still happening? No, I'm taking over a different SQS. The other thing is, what I'm taking over is there's a different SQS that's going to be running, which is not, it has not, it's related to collections and you, and we will be talking about it once we start working on it, but it's not, it's not related to like your work, if that makes any sense. No new updates? No new updates on moving? Oh, moving, yeah, I mean, kind of decided, right, in the next year, may I show? Okay, so but still like the how are you? Finding, oh, finding I haven't yet made because even if I have to, you know, to rent anything, it's too early, right, for me to. And of course, giving more details about the status of the payments and how they will be reflected into the UI and then, you know, as every design conversation, it just turns into like, hey, we should put that in capital case or into lower case or lightning to the left and so on.","2025-10-07 22:13:30"
3,2025-10-07T14:00:00,2025-10-07T15:00:00,"Yeah I'm super good with it Oh Okay, this should be relatively straightforward for us for the admin endpoint, we want to add a function where we're checking that if the shortcode that we're passing in through the admin endpoint is either a consumer or a commercial and then depending on that shortcode type, we're checking the input or the request body and then we'll just throw like forgot to like bad requests exception if it's no expect got it got it okay go ahead and bring yeah that makes sense I'd imagine you we can't do it in the validator though because you wouldn't want to inject anything outside of the CBR interface you'd probably do it in CBR and you might be able to use the validator because I'm pretty sure if you like add a request box objects like you need a validator in order for them point to work yeah but I'm saying like do we want to just do a generic validator and then have the validation in CBR because I don't know if we want to inject anything beyond the credit pure reporting interface in the core project does that make sense am I am I don't know what do you think Alberto I think I see what you're saying and I think in this scenario right now we do we do we use yeah for that admin endpoint for to create the bundles are we talking to the collection to the Bureau reporting service yeah so what we do is we create an interface so it's it's currently using the credit pure reporting interface and then that is in credit bureau reporting and like, but we don't inject like anything beyond the credit bureau reporting interface, yeah. And then the second thing that we notice is that this, the, with giving with per pay, then number of tasks that we're creating are starting to grow to like 70k right so where we've had days where we're processing 70k and so the problem with that is that you know it's not made is not a scale because you know we have things such as the noisy neighbor problem where you know we have daily pay that we have to first process all the daily pays and then we process a phoenix pays right and so this is not gonna fix it 100% but at least it'll make us scale more because we're gonna have that number of instances of SOR will be the number of consumers so we'll be able to consume her like and like you know asynchronously various different tasks right so it's gonna fix that and another thing is if we ever get interrupted since we're just pushing everything to a queue like if SOR gets shut down and it starts again it's just gonna pick up from whatever is in the queue right like it doesn't have to rely in the court So this is kind of like the first effort to try to make the collection service more scalable. We'll look at the configuration and to see of the Account is configured for this and then it'll create it'll forward this to the task service Create the task so again get scheduled with me So you're gonna the person is probably gonna have to update the collections task service to do that to Create that entry and then that's pretty much it and there is gonna be that business logic That's gonna look at obviously the configuration that was already created previously says hey How many days past you is gonna grab date it's gonna add it is gonna like time now or like time of when probably time now plus one and then Tasks something along those lines obviously Yeah, actually Alberto I do have a question on that so I start started working on this and I think probably I can discuss that question later but where do we store the configs? Is that going to be a, it's more like a design question? Well that table that you have, the collections, but the program, that one. Oh yes you're right I missed those ones good one I think we have some time for to do some of these and otherwise we can still also point them during the what's it called but we can I think we have like five minutes so we can definitely do some of these is there one do you want me to pull in or yes if you go back to the backlog probably we can just I have changed the epic color so it's easy I have put together everything in this one spot all the all the secure card tickets are on the top of backlog yes yeah almost five all right cool so I guess we can go from this one and I I deleted mine from the spreadsheet at the beginning of the meeting I it's it's in relation to the per-pay refunded payment that they Yeah, and I got confirmation from Diana.","2025-10-07 22:13:30"
4,2025-10-07T15:00:00,2025-10-07T16:00:00,"This is basically renaming the Enum secure card to secured card and updating the open API, updating the Enum and database and any code references that needs to be fixed. We also have to update any existing data in the database because the brand has addressed one of the ticket that creates the payment sources and everything. I don't know if we can pick it up this print because this is a like a last task for us to do to remove the ACH processor type from the program table. You just have to, whoever picks this up, have to make sure that they commit only the files what they need for this test to work.","2025-10-07 22:13:30"
5,2025-10-07T16:00:00,2025-10-07T17:00:00,"I know this one, I see. Thank you.","2025-10-07 22:13:30"
6,2025-10-07T17:00:00,2025-10-07T18:00:00,"I didn't like it or not? What are you going to say to this lady? So after this you have to eat I will eat now You tell me the scene I have seen Edgain doing fast fast I am watching Edgain Who comes in the end? No! His copycat I have touched it I swear I will not make it I don't know what is his copycat His mind filters He is very angry He is very angry Golden Ford comes in the end No, I'm saying that it looks very funny compared to what we know I actually don't like it It's true that it's very bad I'm a little bit upset I was just saying that you can go to the head game and mindhunt us You'll see, give me 3 points Very. Yes, it's not necessary to watch the whole thing, just watch it It's not that good Okay, I mean I didn't watch the whole thing A lot of people said it's a good thing I watched it for a long time Yes, it's not that good Actually, it's not that good I mean, everyone should watch it It's not that good So he actually kills people and then because he can't do that, he preserve it and then put it on the suit It's the same thing He can't talk He can't eat He said ok, I'll eat Let's talk about what we are doing now. This is my present I'm gonna give no world When I'm just gonna set it down This is my present This is my present Oh, somebody hit a blowjob This is my pulse-out Yeah, well, it's not gonna be back to the same Oh, I'm not that bad I'm just gonna maybe take this My voice is gonna be a pop Okay, everybody on your list I mean, a drummer, a keyboardist, and I'm gonna Two, three, four Go! Hello Oh, be good I feel like I'm seeing a lot of new lenses. So I'm gonna let Dave- Why don't you go outside and take out a shot of this little ham now, okay? Why don't you always film my ham now? I don't know, brain, build, why don't you have last episode? Okay, see? I can tell by the sound of the video.","2025-10-07 22:13:30"
